{
  "kind": "platform-client-registration",
  "bundle_id": "33333333-3333-4333-8333-333333333333",
  "pair_id": "11111111-1111-4111-8111-111111111111",
  "profile_version": 1,
  "client": {
    "sender_id": "agent-mine-qy-001",
    "party_id": "operator-qy-001",
    "mine_id": "MINE-QY-001",
    "mine_name": "示例煤矿（仅契约测试）",
    "comparison_context": {
      "capacity_band": "0.9-1.2Mtpa",
      "mining_method": "underground-longwall",
      "shift_system": "three-shift-eight-hour",
      "coal_type": "thermal-coal",
      "operating_regime": "normal-production"
    },
    "active_message_key_id": "mine-qy-001-message-2026q3",
    "message_keys": {
      "mine-qy-001-message-2026q3": "example_application_secret_32_bytes_minimum"
    },
    "transport_secrets": [
      "example_transport_secret_distinct_32_bytes"
    ]
  },
  "platform_identity": {
    "system_id": "mineguard-qinyuan",
    "party_id": "regulator-qinyuan",
    "key_id": "regulator-message-2026q3"
  }
}
